{
  "id": "forge",
  "name": "JANEF Forge",
  "version": "2.0.0",
  "domain": "core",
  "description": "Entry point and router for JANEF Forge, the engineering-discipline system for coding agents. Use at the start of any substantive software-engineering task (implement, fix, refactor, review, design, migrate, deploy, audit) to apply the engineering contract, estimate risk, and select the smallest sufficient capability set. Invoke as /forge <task>, /forge lean|standard|high-assurance <task>, or /forge security pass. Not for non-technical writing or research.",
  "triggers": [
    "implement",
    "implementation",
    "build",
    "add",
    "create",
    "write code",
    "code",
    "coding",
    "fix",
    "bug",
    "debug",
    "refactor",
    "review",
    "pull request",
    "pr",
    "diff",
    "test",
    "tests",
    "feature",
    "endpoint",
    "api",
    "function",
    "class",
    "module",
    "component",
    "service",
    "migration",
    "schema",
    "database",
    "query",
    "deploy",
    "pipeline",
    "ci",
    "docker",
    "kubernetes",
    "terraform",
    "infrastructure",
    "auth",
    "login",
    "security",
    "vulnerability",
    "secret",
    "secrets",
    "logging",
    "audit",
    "threat model",
    "performance",
    "latency",
    "memory leak",
    "ui",
    "frontend",
    "backend",
    "accessibility",
    "a11y",
    "css",
    "react",
    "vue",
    "angular",
    "next.js",
    "typescript",
    "javascript",
    "python",
    "go",
    "rust",
    "java",
    "sql",
    "repository",
    "repo",
    "codebase",
    "script",
    "cli",
    "library",
    "package",
    "dependency",
    "dependencies",
    "compile",
    "build failure",
    "regression",
    "crash",
    "error",
    "exception",
    "flaky",
    "commit",
    "branch",
    "merge",
    "rebase",
    "git",
    "documentation",
    "readme",
    "adr",
    "runbook",
    "webhook",
    "worker",
    "queue",
    "cache",
    "config",
    "configuration",
    "rollback",
    "release",
    "monorepo",
    "logs",
    "context",
    "store",
    "storage",
    "bucket",
    "s3",
    "file",
    "files",
    "upload",
    "editor",
    "page",
    "button",
    "app",
    "application",
    "website",
    "web app",
    "server",
    "client",
    "faster",
    "slow",
    "broken",
    "clean",
    "tidy",
    "optimize",
    "table",
    "drop",
    "staging",
    "production",
    "column",
    "index",
    "drop table",
    "job",
    "jobs",
    "investigate",
    "times out",
    "rbac",
    "permissions",
    "roles",
    "impersonate",
    "users"
  ],
  "negative_triggers": [
    "marketing email",
    "social post",
    "social media post",
    "blog post",
    "press release",
    "travel itinerary",
    "translate",
    "translation",
    "summarize this article",
    "creative story",
    "poem",
    "recipe",
    "cover letter",
    "resume",
    "essay",
    "newsletter",
    "ad copy",
    "slogan",
    "tagline"
  ],
  "risk_level": "low",
  "context_cost": "medium",
  "requires": [],
  "optional_with": [],
  "conflicts_with": [
    "janef"
  ],
  "verification_requirements": [
    "state the selected capabilities, skipped capabilities, estimated risk, and active profile before implementing",
    "apply the verification tier for the estimated risk before claiming completion"
  ],
  "supported_hosts": [
    "claude-code",
    "codex"
  ],
  "references": [],
  "status": "stable",
  "responsibilities": [
    "routing",
    "engineering-contract",
    "profile-selection",
    "risk-classification"
  ],
  "priority": 100,
  "provenance": [
    "janefskills 1.2.0 janef (orchestration and routing table)",
    "agent-engineering-stack 1.1.0 engineering-router and policy fragment",
    "lean-code-engineer 0.1.0 SKILL.md core loop and priority order"
  ]
}
