{
  "id": "database-integrity",
  "name": "Database Integrity",
  "version": "2.0.0",
  "domain": "engineering",
  "description": "Schema design, migrations, transactions, indexes, query behavior, backfills, and tenant isolation or RLS. Treats every schema or migration change as high risk because deployed data already exists. Use for SQL, ORMs, data models, migration strategy, query performance, or data-integrity questions.",
  "triggers": [
    "database",
    "db",
    "sql",
    "postgres",
    "postgresql",
    "mysql",
    "sqlite",
    "schema",
    "migration",
    "migrations",
    "migrate",
    "table",
    "tables",
    "column",
    "columns",
    "index",
    "indexes",
    "indices",
    "foreign key",
    "foreign keys",
    "constraint",
    "constraints",
    "transaction",
    "transactions",
    "n+1",
    "orm",
    "prisma",
    "drizzle",
    "sequelize",
    "typeorm",
    "sqlalchemy",
    "query plan",
    "explain analyze",
    "rls",
    "row level security",
    "row-level security",
    "backfill",
    "seed data",
    "data model",
    "nullability",
    "unique constraint",
    "supabase",
    "stored procedure",
    "trigger",
    "deadlock",
    "isolation level",
    "security definer",
    "policy",
    "database role",
    "app role",
    "tenants table",
    "drop table",
    "drop column",
    "truncate"
  ],
  "negative_triggers": [
    "sql injection"
  ],
  "risk_level": "high",
  "context_cost": "small",
  "requires": [],
  "optional_with": [
    "api-contracts",
    "performance-scalability",
    "testing-verification"
  ],
  "conflicts_with": [],
  "verification_requirements": [
    "migration applied from zero and on representative data",
    "constraint, concurrency, and rollback or forward-fix paths tested",
    "query plans inspected for performance-sensitive production queries",
    "RLS or tenant scoping verified with a denied cross-tenant query when relevant"
  ],
  "supported_hosts": [
    "claude-code",
    "codex"
  ],
  "references": [],
  "status": "stable",
  "responsibilities": [
    "schema-and-migrations",
    "transaction-semantics",
    "query-integrity",
    "tenant-data-isolation"
  ],
  "priority": 62,
  "provenance": [
    "agent-engineering-stack 1.1.0 database-integrity",
    "lean-code-engineer 0.1.0 modules/database",
    "janefskills 1.2.0 engineering-standard (database discipline)"
  ]
}
