{
  "id": "devops-reliability",
  "name": "DevOps, Cloud & Reliability",
  "version": "2.0.0",
  "domain": "engineering",
  "description": "CI/CD pipelines, containers, infrastructure as code, cloud services and IAM, deployment and rollout strategy, rollback, backups and restore, monitoring and alerting, and reliability controls. Use for any workflow, Dockerfile, Terraform, Kubernetes, cloud, deployment, or operations change. Production and infrastructure mutations require explicit authorization.",
  "triggers": [
    "ci",
    "cd",
    "ci/cd",
    "pipeline",
    "pipelines",
    "github actions",
    "workflow",
    "workflows",
    "docker",
    "dockerfile",
    "container",
    "containers",
    "kubernetes",
    "k8s",
    "helm",
    "terraform",
    "pulumi",
    "iac",
    "infrastructure",
    "infra",
    "deploy",
    "deployment",
    "deployments",
    "rollout",
    "rollback",
    "release pipeline",
    "monitoring",
    "alerting",
    "alerts",
    "sre",
    "health check",
    "readiness",
    "liveness",
    "aws",
    "gcp",
    "azure",
    "cloud",
    "iam",
    "vpc",
    "lambda",
    "serverless",
    "backup",
    "backups",
    "restore",
    "disaster recovery",
    "rpo",
    "rto",
    "uptime",
    "on-call",
    "incident",
    "outage",
    "autoscaling",
    "load balancer",
    "cdn",
    "dns",
    "nginx",
    "environment",
    "staging",
    "production"
  ],
  "negative_triggers": [
    "migration",
    "migrations",
    "production ready",
    "production-ready"
  ],
  "risk_level": "high",
  "context_cost": "small",
  "requires": [],
  "optional_with": [
    "secrets-guard",
    "security-logging",
    "testing-verification"
  ],
  "conflicts_with": [],
  "verification_requirements": [
    "workflow/IaC/container config validated with a non-mutating plan, lint, or dry-run",
    "rollout, rollback, health checks, and failure propagation verified before production changes",
    "least privilege confirmed for CI identities and cloud roles"
  ],
  "supported_hosts": [
    "claude-code",
    "codex"
  ],
  "references": [],
  "status": "stable",
  "responsibilities": [
    "delivery-pipeline",
    "infrastructure-and-cloud",
    "operational-reliability"
  ],
  "priority": 56,
  "provenance": [
    "agent-engineering-stack 1.1.0 devops-reliability",
    "lean-code-engineer 0.1.0 modules/devops and modules/cloud"
  ]
}
